{
  "schema_version": 1,
  "vault_id": "vlt_00000001-0000-4000-8000-000000000001",
  "revision": 2,
  "primary": {
    "host_id": "dev_00000001-0000-4000-8000-000000000001",
    "primary_epoch": 1
  },
  "checkpoint": {
    "commit_id": "cmt_00000001-0000-4000-8000-000000000001",
    "commit_sequence": 1,
    "snapshot_hash": "aaaaaaaaaaaaaaaaaaaaaaaaaaaaaaaaaaaaaaaaaaaaaaaaaaaaaaaaaaaaaaaa",
    "policy_epoch": 0,
    "deletion_epoch": 0
  },
  "phase": {
    "state": "quiesced",
    "plan": {
      "schema_version": 1,
      "intent": {
        "vault_id": "vlt_00000001-0000-4000-8000-000000000001",
        "operation_id": "op_00000001-0000-4000-8000-000000000001",
        "source": {
          "host_id": "dev_00000001-0000-4000-8000-000000000001",
          "primary_epoch": 1
        },
        "target_host": "dev_00000002-0000-4000-8000-000000000001",
        "base_revision": 1,
        "checkpoint": {
          "commit_id": "cmt_00000001-0000-4000-8000-000000000001",
          "commit_sequence": 1,
          "snapshot_hash": "aaaaaaaaaaaaaaaaaaaaaaaaaaaaaaaaaaaaaaaaaaaaaaaaaaaaaaaaaaaaaaaa",
          "policy_epoch": 0,
          "deletion_epoch": 0
        }
      },
      "plan_hash": "cd5f38f9ddf98a2d52ec3ff61e9aef76661c28358e40a542f7471d43724096c7"
    }
  },
  "promotions": []
}
