{
  "schema_version": 1,
  "vault_id": "vlt_00000001-0000-4000-8000-000000000001",
  "revision": 1,
  "primary": {
    "host_id": "dev_00000001-0000-4000-8000-000000000001",
    "primary_epoch": 1
  },
  "checkpoint": {
    "commit_id": "cmt_00000001-0000-4000-8000-000000000001",
    "commit_sequence": 1,
    "snapshot_hash": "aaaaaaaaaaaaaaaaaaaaaaaaaaaaaaaaaaaaaaaaaaaaaaaaaaaaaaaaaaaaaaaa",
    "policy_epoch": 0,
    "deletion_epoch": 0
  },
  "phase": {
    "state": "active"
  },
  "promotions": []
}
